"Karim Aït-Fana, French-Moroccan football player
"Jamal Akachar, Dutch-Moroccan football player
"Zakaria Alaoui, football player
"Avi Alfasi, Israeli football player
"Rachid Alioui, French-Moroccan football player
"Mustapha Allaoui, football player
"Mohammed Alí Amar, Spanish football player
"Ahmed Ammi, Dutch-Moroccan football player
"Nordin Amrabat, Dutch football player
"Ofir Amram, Israeli football player
"Mohamed Amsif, German-born Moroccan football goalkeeper
"Yossi Asayag, Israeli football player
"Maor Asor, Israeli football player
"Gai Assulin, Israeli football player
"Lior Asulin, Israeli football player
"Eliran Atar, Israeli football player
"Reuven Atar, Israeli football player
"Roi Atar, Israeli football player
"Shalom Avitan, Israeli football player
"Timor Avitan, Israeli football player
"Zohra Ayachi, French football player
"Mimoun Azaouagh, Moroccan-born German footballer
"Aviv Azaria, Israeli football player
"Eitan Azaria, Israeli football player
"Karim Azizou, French-Moroccan football player
"Yaniv Azran, Israeli football player
"Hen Azriel, Israeli football player
"Shlomi Azulay, Israeli football player
"Nabil Baha, French-Moroccan football player
"Otman Bakkal, Dutch-Moroccan football player
"Said Bakkati, Dutch-Moroccan football player
"Shahar Balilti, Israeli football player
"Yacine Bammou, French-Moroccan football player
"Eden Batit, Israeli football player
"Nacer Barazite, Dutch-Moroccan football player
"Abdelaziz Barrada, French-Moroccan football player
"Michaël Chrétien Basser
"Chahir Belghazouani, French-Moroccan football player
"Younès Belhanda, French-Moroccan football player
"Tamir Ben Ami, Israeli football player
"Aziz Ben Askar, French football player
"Medhi Benatia, French-Moroccan football player
"Yossi Benayoun, Israeli football player
"Larbi Benbarek, Moroccan football player
"Dedi Ben Dayan, Israeli football player
"Omri Ben Harush, Israeli football player
"Shlomi Ben Hemo, Israeli football player
"Asaf Ben-Muha, Israeli football player
"Ismaël Bennacer, French football player
"Armon Ben-Naim, Israeli football player
"Asael Ben Shabat, Israeli football player
"Galil Ben Shanan, Israeli football player
"Ran Ben Shimon, Israeli football player
"Amit Ben Shushan, Israeli football player
"Netanel Ben Simon, Israeli football player
"Benny Ben Zaken, Israeli football player
"David Biton, Israeli football player
"Eran Biton, Israeli football player
"Moshe Biton, Israeli football player
"Ori Biton, Israeli football player
"Ben Bitton, Israeli football player
"Dan Bitton, Israeli football player
"Shimon Bitton, Israeli football player
"Younes Bnou Marzouk, French-Moroccan football player
"Rachid Bouaouzan, Dutch-Moroccan football player
"Elbekay Bouchiba, Dutch-Moroccan football player
"Aziz Bouderbala, football player
"Sofiane Boufal, French-Moroccan football player
"Kamel Boughanem, French-Moroccan football player
"Samir Boughanem, French-Moroccan football player
"Khalid Boulahrouz, Dutch-Moroccan football pla
"Nourdin Boukhari, Dutch-Moroccan football player
"Mourad Bounoua, French-Moroccan football player
"Ali Boussaboun, Dutch-Moroccan football player
"Dries Boussatta, Dutch-Moroccan football player
"Mbark Boussoufa, Dutch-Moroccan football player
"Khalid Boutaïb, French-Moroccan football player
"Said Boutahar, Dutch-Moroccan football player
"Ben Butbul, Israeli football player
"Mehdi Carcela-Gonzalez (Spanish father, Moroccan mother)
"Samir Carruthers, Israeli football player
"Kamel Chafni, French-Moroccan football player
"Aatif Chahechouhe, French-Moroccan football player
"Abdelhali Chaiat, Dutch-Moroccan football player
"Khalid Chalqi, Moroccan-born French football player
"Marouane Chamakh, French-Moroccan football player
"Mohammed Chaouch, football player
"Issam Chebake, football player
"Almog Cohen, Israeli football player
"Meir Cohen, Israeli football player
"Mehdi Courgnaud, French football player
"Manuel da Costa (footballer) (Portuguese father, Moroccan mother)
"Mor Dahan, Israeli football player
"Rafi Dahan, Israeli football player
"Karim Dahou, French football player
"Kenza Dali
"Guy Dayan, Israeli football player
"Roei Dayan, Israeli football player
"Anouar Diba, Dutch-Moroccan football player
"Kieran Djilali, British football player
"Olivier Echouafni, French football player
"Amir Edri, Israeli football player
"Kfir Edri, Israeli football player
"Shimon Edri, Israeli football player
"Shlomi Edri, Israeli football player
"Issam El Adoua, football player
"Karim El Ahmadi, Dutch-Moroccan football player
"Youssef El Akchaoui, Dutch-Moroccan football player
"Ahmed El Aouad, French-Moroccan football player
"Youssef El-Arabi, French-born football player
"Yassin El-Azouzi, French-Moroccan football player
"Eli Elbaz, Israeli football player
"Tomer Elbaz, Israeli football player
"Hakim El Bounadi, French-Moroccan football player
"Faouzi El Brazi, football player
"Samir El Gaaouiri, Dutch-Moroccan football player
"Mustafa El Haddaoui, football player
"Mounir El Haimour, French-Moroccan football player
"Oualid El Hajjam, French football player
"Mounir El Hamdaoui, Dutch-Moroccan football player
"Karim El Idrissi, French-Moroccan football player
"Faysal El Idrissi, French-Moroccan football player
"Shavit Elimelech, Israeli football player
"Alharbi El Jadeyaoui, French-Moroccan football player
"Moestafa El Kabir, Dutch-Moroccan football player
"Badr El Kaddouri
"Abdelhamid El Kaoutari, French football player
"Itay Elkaslasy, Israeli football player
"Eliran Elkayam, Israeli football player
"Oded Elkayam, Israeli football player
"Aziz El Khanchaf, French-Moroccan football player
"Ali El Khattabi, Dutch-Moroccan football player
"Abdou El-Kholti, French football player
"Omri Elmakyes, Israeli football player
"Nisim Elmaliah, Israeli football player
"Bouchaib El Moubarki
"Karim El Mourabet, French-Moroccan football player
"Samir El Moussaoui, Dutch-Moroccan football player
"Ali El-Omari, French-Moroccan football player
"Moha
"Tarik Elyounoussi
"Nabil El Zhar, French football player
"Saïd Ennjimi, Moroccan-born French football player
"Hen Ezra, Israeli football player
"Karim Fachtali, Dutch-Moroccan football player
"Omer Fadida, Israeli football player
"Fayçal Fajr, French-Moroccan football player
"Mohammed Faouzi, Dutch-Moroccan football player
"Marouane Fellaini
"Rayan Frikeche, French-Moroccan football player
"Dovev Gabay, Israeli football player
"Ronen Gabay, Israeli football player
"Shoval Gozlan, Israeli football player
"Ben Grabli, Israeli football player
"Mustapha Hadji
"Youssef Hadji
"Youssouf Hadji, Moroccan football player
"Samir Hadji, French-Moroccan football player
"Anouar Hadouir, Dutch-Moroccan football player
"Ofir Haim, Israeli football player
"Kheira Hamraoui, French female football player
"Ariel Harush, Israeli football player
"Shimon Harush, Israeli football player
"Gadi Hazut, Israeli football player
"Tal Hen, Israeli football player
"Adil Hermach, French-Moroccan football player
"Golan Hermon, Israeli football player
"Samy Houri, French-Moroccan football player
"Lyes Houri, French-Moroccan football player
"Youssef Idrissi, French-Moroccan football player
"Oz Ifrah, Israeli football player
"Shlomo Iluz, Israeli football player
"Avi Ivgi, Israeli football player
"Avishai Jano, Israeli football player
"Younès Kaabouni, French football player
"Younès Kaboul, French football player
"Abderrahman Kabous, French-Moroccan football player
"Ahmed Kantari, French-Moroccan football player
"Sakina Karchaoui, French female football player
"David Keltjens, Israeli football player
"Houssine Kharja, Moroccan football player
"Younes Khattabi, Moroccan rugby league player
"Avi Knafo, Israeli football player
"Zakaria Labyad
"Hoda Lattaf, French female football player
"Amine Lecomte, French football player
"Moshe Lugasi, Israeli football player
"Nassir Maachi, Dutch-Moroccan football player
"Mouaad Madri, French-Moroccan football player
"Zinédine Machach, French football player
"Riyad Mahrez, French-Moroccan football player
"Tal Makhlouf, Israeli football player
"Ben Malka, Israeli football player
"Haim Malka, Israeli football player
"Sean Malka, Israeli football player
"Zadok Malka, Israeli football player
"Dor Malul, Israeli football player
"Shmulik Malul, Israeli football player
"Adir Maman, Israeli football player
"Baruch Maman, Israeli football player
"Hanan Maman, Israeli football player
"Mor Maman, Israeli football player
"Ofir Marciano, Israeli football player
"Mehdi Messaoudi, French-Moroccan football player
"Mourad Mghizrat, Dutch-Moroccan football player
"Offer Mizrahi, Israeli football player
"Ofir Mizrahi, Israeli football player
"Smail Morabit, French-Moroccan football player
"Yassin Moutaouakil, French football player
"Kobi Moyal, Israeli football player
"Eden Nachmani, Israeli football player
"Nir Nachum, Israeli football player
"Chafik Najih, French football player
"Noureddine Naybet
"Mounir Obbadi, French-Moroccan football player
"Eli Ohana, Israeli football player
"Michael Ohana, Israeli football player
"Matan Ohayon, Israeli football player
"Moshe Ohayon, Israeli football player
"Amine Oudrhiri, French football player
"Reuven Oved, Israeli football player
"Dor Peretz, Israeli football player
"Omer Peretz, Israeli football player
"Omer Peretz, Israeli football player
"Oz Peretz, Israeli football player
"Reef Peretz, Israeli football player
"Yacine Qasmi, French-Moroccan football player
"Adil Rami, French football player
"Adil Ramzi
"Adrien Regattin, French football player
"Hoalid Regragui, French-Moroccan football player
"Hamid Rhanem, French football player
"David Revivo, Israeli football player
"Haim Revivo, Israeli football player
"Shay Revivo, Israeli football player
"Yonatan Revivo, Israeli football player
"Youssef Rossi, football player
"Moshe Sabag, Israeli football player
"Youssef Safri
"Karim Safsaf, French football player
"Romain Saïss, French football player
"Hamza Sakhi, French-Moroccan football player
"Victor Sarusi, Israeli football player
"Salaheddine Sbai, football player
"Youssef Sekour, French-Moroccan football player
"Tarik Sektioui, football player
"Nitzan Shirazi, Israeli football player
"Shlomo Shirazi, Israeli football player
"Ofer Shitrit, Israeli football player
"Idan Shriki, Israeli football player
"Liran Shriki, Israeli football player
"Mor Shushan, Israeli football player
"Ron Shushan, Israeli football player
"Shay Sibony, Israeli football player
"Khalid Sinouh, Dutch-Moroccan football player
"Hassan Souari, football player
"Mounir Soufiani, French football player
"Tomer Swisa, Israeli football player
"Adel Taarabt, Moroccan football player
"Farid Talhaoui, French football player
"Mehdi Taouil, French football player
"Eitan Tibi, Israeli football player
"Karim Touzani, Dutch-Moroccan football player
"Yoann Touzghar, French football player
"Smahi Triki, football player
"Adir Tubul, Israeli football player
"Alon Turgeman, Israeli football player
"Amir Turgeman, Israeli football player
"Ben Turjeman, Israeli football player
"Guy Tzarfati, Israeli football player
"Idan Weitzman, Israeli football player
"Yisrael Zaguri, Israeli football player
"Jawad Zairi
"Moris Zano, Israeli football player
"Badou Zaki
"Merouane Zemmama
"Roei Zikri, Israeli football player
"Abdellah Zoubir, French football player
"Niv Zrihan, Israeli football player
"Josh Tordjman, Canadian ice hockey goaltender
"Cyril Abidi, Savate Champion and Muay Thai World Champion
"Badr Hari, K-1 Heavyweight champion and K-1 World GP 2008 finalist
"Chalid Arrab
"Faldir Chahbari
"Chahid Oulad El Hadj
"Aziz Jahjah
"Karim Ghajji, French kickboxer and B-boy
"Lee Lamrani Ibrahim "Lightning" Murray, cage fighter turned gangster (Moroccan father, English mother)
"Khalid Ismail, MMA-fighter
"Zakaria Moumni, Moroccan kickboxer
"Farid Villaume, French Muay Thai kickboxer
"Abdelatif Benazzi
"Abdellatif Boutaty, rugby union player
"Abderazak El Khalouki, French rugby league player
"Jamal Fakir, Moroccan-born French rugby league player
"Adel Fellous, French rugby league player
"Younes Khattabi
"Djalil Narjissi
"Fouad Yaha, French rugby league player.
"Victor Soussan, Moroccan-born Australian Grand Prix motorcycle racing
"Michaël Benyahia, Moroccan-American Open Wheel Race Car Driver, 2017 Formula Renault NEC Champion 2017 Formula Renault Northern European Cup
"Moe Sbihi
"Vered Buskila, Israeli  Olympic sailor with Moroccan roots
"Kenza Tazi, Moroccan-American alpine skier; Olympian
"Adam Lamhamedi, Moroccan-Canadian alpine skier; Olympian
"Samir Azzimani, Moroccan-French alpine skier; Olympian
"Abdelhakim Bagy, Moroccan-born French long-distance runner
"Abdellah Béhar, Moroccan-born runner specialized in the 5000 metres and cross-country running
"Fouad Chouki, French middle distance runner, specialized in the 1500 metres
"Driss El Himer, Moroccan-born long-distance runner
"Abderrahim El Haouzy, Moroccan-born French sprinter
"Mustapha Essaïd, Moroccan-born French runner who specialized in the 5000 meters
"Mohamed Ezzher, Moroccan-born French long distance runner
"Adam Gemili, British sprinter
"Brahim Lahlafi, Moroccan former long-distance runner
"Driss Maazouzi, Moroccan-born 1500 meters athlete runner
"Mohamed Ouaadi, Moroccan-born French long-distance runner who specialized in the marathon
"Yamna Oubouhou, Moroccan-born French long-distance runner
"Ismaïl Sghyr, French-Moroccan long-distance runner
"Mounir Yemmouni, Moroccan-born French middle distance runner specialized in the 1500 meters
"Karim Alami
"Hicham Arazi
"Younes El Aynaoui
"Lina Qostal, Moroccan tennis player
"Layla El
"Adriana Behar
"Eliette Abécassis, French writer, novelist and playwright
"Leila Abouzeid, Arabic-language novelist
"Mohammed Achaari, writer, poet and politician
"Said Achtouk, poet, musician and songwriter
"Mririda n’Ait Attik (c. 1900–c. 1930), Tashelhit-language poet
"Lotfi Akalay, writer and businessman
"Idriss ibn al-Hassan al-Alami (1925–2007)
"Mohammed ibn Mohammed Alami, poet
"Allal al-Fassi (1910–1974)
"Malika al-Fassi, journalist, playwright, novelist
"Mohammed al-Habib al-Fourkani (1922–2008)
"Abd al-Aziz al-Ghumari (1920–1997)
"Abdullah al-Ghumari (1910–1993)
"Ahmad al-Ghumari (1902–1961)
"Mohammed Abed al-Jabri (1936–2010)
"Ahmad al-Tayyeb Aldj (born 1928)
"Tewfik Allal (born 1947)
"Ahmed al-Madini (born 1949)
"Mohammed al-Makki al-Nasiri (1906–1994)
"Tuhami al-Wazzani (1903–1972)
"Ali ibn Qasim al-Zaqqaq (died 1506)
"Ali Azaykou (1942–2004)
"Latifa Baka, novelist, short story writer
"Muriel Barbery, Moroccan-born French novelist, educator
"Hafsa Bekri, poet, short story writer, feminist writer
"Abdelmalek Belghiti (1906–2010)
"Abdelkader Benali (born 1975)
"Mehdi Ben Barka (1920–1965)
"Siham Benchekroun, novelist, poet, short story writer
"Rajae Benchemsi, poet, essayist, novelist
"Esther Bendahan, Moroccan-born Spanish non-fiction writer, novelist
"Abdelmajid Benjelloun (1919–1981)
"Abdelmajid Benjelloun (born 1944)
"Tahar Ben Jelloun (born 1944)
"Abdelwahab Benmansour (1920–13 November 2008)
"Mohammed Suerte Bennani (born 1961)
"Mohammed Bennis (born 1948)
"Khnata Bennouna, novelist, short story writer
"Khnata bent Bakkar, dowager sultana, biographer, letter writer
"Mohammed Benzakour (born 1972)
"Mohammed Berrada (born 1938)
"Hafsa Bikri
"Mahi Binebine (born 1959)
"Ali Bourequat
"Ahmed Bouzfour (born 1954)
"Al-Yazid al-Buzidi Bujrafi (born 1925)
"Mohamed Chafik (born 1926)
"Nadia Chafik, novelist, non-fiction writer, educator
"Driss Ben Hamed Charhadi (1937–1986)
"Isaac Chocrón, Venezuelan economist, playwright and translator.
"Sonia Chocrón, Venezuelan poet, novelist, screenwriter and playwright
"Mohamed Choukri (1935–2003)
"Driss Chraïbi (1926–2007)
"Mohammed Daoud (1901–1984)
"Zakya Daoud, French-born Moroccan journalist, magazine editor, non-fiction writer
"Farida Diouri, novelist
"Najat El Hachmi (born 1979)
"Youssouf Amine Elalamy (born 1961)
"Mohammed Aziz El-Hababi (1922–1993)
"Najat El Hachmi, Spanish-Moroccan writer
"Allal El Hajjam (born 1948)
"Driss El Khouri
"Edmond Amran El Maleh (1917–2010)
"Mahdi Elmandjra (born 1933)
"Mohammed El-Moustaoui (born 1943)
"Youssef Fadel (born 1949)
"Halima Ferhat
"Éric Fottorino, French writer and journalist
"Abdelkrim Ghallab (1919–2006)
"Soumya Naâmane Guessous, best selling non-fiction writer, sociologist, educator
"Abdallah Guennoun (1910–1989)
"Ali Haddani (1936–2007)
"Badia Hadj Nasser
"Ahmed Harrak Srifi (died 1925)
"Ben Salem Himmich (born 1947)
"Ali Squalli Houssaini (born 1932)
"Salim Jay (born 1951)
"Liz Jensen
"Abderrafi Jouahri (born 1943)
"Abdelkarim Jouiti (born 1962)
"Ahmed Joumari (1939–1995)
"Maati Kabbal
"Maguy Kakon, non-fiction writer, women's rights activist
"Mohammed Kaghat (1942–2001)
"Mohammed Khammar Kanouni (1938–1991)
"Mohammed Khaïr-Eddine (1941–1995)
"Abdelkebir Khatibi (born 1938)
"Rita El Khayat, psychiatrist, publisher, women's rights activist, non-fiction writer
"Abdelaziz Khourdifi, short story writer
"Abdelfattah Kilito (born 1945)
"Driss Ksikes
"Abdellatif Laabi (born 1942)
"Leila Lahlou, author of the novel Do Not Forget God (1987)
"Mohammed Aziz Lahbabi (1922–1993)
"Abdelrahim Lahbibi (born 1950)
"Laila Lalami, Moroccan-American novelist, essayist
"Wafaa Lamrani, poet
"Abdallah Laroui (born 1933)
"Fouad Laroui (born 1958), Moroccan economist and writer
"Mohammed Leftah (1946–2008)
"Ahmed Lemsih (born 1950)
"Ali Lmrabet (born 1959)
"Zahra Mansouri
"Ahmed Mejjati (1936–1995)
"Saida Menebhi, poet, Marxist activist
"Fatema Mernissi, feminist writer, sociologist
"Mohamed Mrabet (born 1936)
"Mostafa Nissaboury (born 1943)
"Rachid O (born 1970)
"Malika Oufkir, memoirist, author of Stolen Lives: Twenty Years in a Desert Jail
"Touria Oulehri, novelist, critic
"Bachir Qamari (born 1951)
"Mubarak Rabi (born 1938)
"Mohamed Said Raihani (born 1968)
"Fouzia Rhissassi, educator, women's rights activist, non-fiction writer
"Najima Rhozali, non-fiction writer, politician
"Mohammed Sabila
"Abdelhadi Said (born 1974)
"Thouria Saqqat, children's writer
"Simon Sebag Montefiore
"Tayeb Seddiki (born 1938)
"Ahmed Sefrioui (1915–2004)
"Mohamed Serghini (born 1930)
"Abdelhak Serhane
"Mohamed Sibari (born 1945)
"Hourya Sinaceur, philosopher, non-fiction writer
"Mohammed Allal Sinaceur (born 1941)
"Ali Siqli (born 1932)
"Mohammed al-Mokhtar Soussi (1900–1963)
"Abdelkarim Tabbal (born 1931)
"Abdellah Taïa (born 1973)
"Abdelhadi Tazi (born 1921)
"Mahjoub Tobji (born 1942)
"Ralph de Toledano (1916–2007)
"Abdelkhalek Torres (1910–1970)
"Houcine Toulali (1924–1998)
"Ahmed Toufiq (born 1943)
"Bahaa Trabelsi, novelist, journalist, magazine editor
"Said Yaktine (born 1955)
"Nadia Yassine (born 1958)
"Mohamed Zafzaf (1942–2001)
"Mohammed Zniber (1923–1993)
"Abdallah Zrika (born 1953)
"Mohammed ibn Abu al-Qasim al-Sijilmasi (died 1800)
"Mohammed ibn Abd as-Salam ibn Nasir (died 1824)
"Mohammed Ibn Amr (died 1827)
"Thami Mdaghri (died 1856)
"Idriss al-Amraoui (died 1879)
"Ahmad ibn Hamdun ibn al-Hajj (died 1898)
"Abd as-Salam al-Alami (1834–1895)
"Ahmad ibn Khalid al-Nasiri (1835–1897)
"Salomon Berdugo (1854–1906)
"Mohammed ibn Jaafar al-Kattani (1858–1927)
"Ibn Zaydan (1873–1946)
"Muhammad Ibn al-Habib (1876–1972)
"Ahmed Skirej (1878–1944)
"Abdelkrim al-Khattabi (1882–1963)
"Mohammed Boujendar (1889–1926)
"Mohammed Ben Brahim (1897–1955)
"Mohammed ibn abd al-Wahab al-Ghassani (died 1707)
"Mohammed ibn Qasim ibn Zakur (died 1708)
"Mohammed ibn al-Tayyib al-Alami (died 1722)
"Abd al-Qadir ibn Shaqrun (died after 1727/8)
"Mohammed ibn Zakri al-Fasi (died 1731)
"Ahmed ibn al-Mubarak al-Lamti al-Sijilmasi (died 1741)
"Khnata bent Bakkar (died 1754)
"Ibn al-Wannan (died 1773)
"Ahmed al-Ghazzal (died 1777)
"Abd Allah ibn Azzuz (died 1789)
"Mohammed al-Qadiri (1712–1773)
"David Hassine (1722–1792)
"Abu al-Qasim al-Zayyani (1734–1833)
"Kaddour El Alamy (1742–1850)
"Raphael Berdugo (1747–1821)
"Sulayman al-Hawwat (1747–1816)
"Ahmad ibn Ajiba (1747–1809)
"Mohammed al-Duayf (born 1752)
"Mohammed al-Tayyib ibn Kiran (1758–1812)
"Muhammad al-Arabi al-Darqawi (1760–1823)
"Hamdun ibn al-Hajj al-Fasi (1760–1817)
"Ahmad ibn Idris al-Fasi (1760–1837)
"Suleiman al-Alawi (1760–1822)
"Mohammed al-Harraq (1772–1845)
"Mohammed al-Haik (fl. 1790)
"Mohammed al-Tawdi ibn Suda (1790–1794/5)
"Ahmed al-Salawi (1791–1840)
"Mohammed ibn Idris al-Amrawi (1794–1847)
"Mohammed Akensus (1797–1877)
"Hemmou Talb (18th century)
"Isaac Uziel (died 1622)
"Abd al-Rahman al-Tamanarti (died 1650)
"Abu Abdallah Mohammed al-Murabit al-Dila'i (died 1678)
"Mohammed ibn Nasir (1603–1674)
"Mohammed al-Mahdi al-Fasi (1624–1698)
"Mohammed al-Rudani (c. 1627–1683)
"Abu Salim al-Ayyashi (1628–1679)
"Abd al-Rahman al-Fasi (1631–1685)
"Abu Ali al-Hassan al-Yusi (1631–1691)
"Ahmed ibn Nasir (1647–1717)
"Abd as-Salam al-Qadiri (1648–1698)
"Abd al-Wahhab Adarrak (1666–1746)
"Mohammed Awzal (1670–1749)
"Mohammed al-Ifrani (1670–1745)
"Ahmed ibn al-Mubarak al-Lamati (1679–1743)
"Mohammed ibn al-Tayyib (1698–1756)
"Ali ibn Qasim al-Zaqqaq (died 1506)
"Abdallah al-Ghazwani (died 1529)
"Abderrahman El Majdoub (died 1569)
"Abu-l-Hasan al-Tamgruti (died 1594/5)
"Ahmed al-Mandjur (1520–1587)
"Abu Abdallah ibn Askar (1529–1578)
"Abul Qasim ibn Mohammed al-Ghassani (1548–1610)
"Abd al-Aziz al-Fishtali (1549–1621)
"Ahmad Ibn al-Qadi (1553–1616)
"Ahmed ibn Abi Mahalli (1559–1613)
"Abraham Azulai (c. 1570–1643)
"Mohammed al-Arbi al-Fasi (1580–1642)
"Abdelaziz al-Maghrawi (c. 1580–1600)
"Ahmed Mohammed al-Maqqari (c. 1591–1632)
"Mahamad Mayyara (1591–1662)
"Abd al-Qadir al-Fasi (1599–1680)
"Al-Masfiwi (16th century)
"Abdarrahman al-Makudi (died 1405)
"Muhammad al-Jazuli (died 1465)
"Ibrahim ibn Hilal al-Sijilmasi (died c. 1498)
"Ibn Ghazi al-Miknasi (1437–1513)
"Ahmad Zarruq (1442–1493)
"Leo Africanus (1488–1554)
"Abu Mohammed al-Qasim al-Sijilmasi (died 1304)
"Ibn Abi Zar (died c. 1315)
"Abu al-Hassan Ali ibn Mohammed al-Zarwili (died 1319)
"Abd al-Haqq al-Badisi (died after 1322)
"Ibn Shuayb (died 1349)
"Ibn Idhari (beginning of the 14th century)
"Ibn Battuta (1304–1377)
"Mohammed al-Hazmiri (fl. 1320)
"Ibn Juzayy (1321–1357)
"Abu Muqri Mohammed al-Battiwi (fl. 1331)
"Ibn Abbad al-Rundi (1333–1390)
"Abu Yahya ibn al-Sakkak (1335–1415)
"Abd al-Rahman al-Jadiri (1375–1416)
"Ismail ibn al-Ahmar (1387–1406)
"Abu al-Hasan Ali al-Jaznai (14th century)
"Ibn al-Yasamin (died 1204)
"Ahmad ibn Munim al-Abdari (died 1228)
"Ibn al-Zayyat al-Tadili (died 1229/30)
"Abd al-Rahman al-Fazazi (died 1230)
"Ali ibn al-Qattan (died 1231)
"Ibn al-Khabbaza (died 1239)
"Abdelaziz al-Malzuzi (died 1298)
"Salih ben Sharif al-Rundi (1204–1285)
"Malik ibn al-Murahhal (1207–1289)
"Ibn abd al-Malik al-Marrakushi (1237–1303)
"Mohammed ibn Hajj al-Abdari al-Fasi (c. 1256–1336)
"Ibn al-Banna al-Marrakushi (1256–1321)
"Mohammed ibn Rushayd (1259–1321)
"Mohammed ibn Adjurrum (1273–1323)
"Abu Ali al-Hasan al-Marrakushi (fl. 1281/2)
"Mohammed al-Abdari al-Hihi (fl. c. 1289)
"Judah ben Nissim (13th century)
"Ibn Bajjah (died 1138)
"Abu Jafar ibn Atiyya (died 1158)
"Ali ibn Harzihim (died 1163)
"Al-Suhayli (1114–1185)
"Zechariah Aghmati (1120–1195)
"Abu al-Abbas as-Sabti (1129–1204)
"Abu al-Abbas al-Jarawi (1133–1212)
"Abd as-Salam ibn Mashish (1140–1227)
"Mohammed ibn Qasim al-Tamimi (1140/5)
"Ibn Dihya al-Kalby (1149–1235)
"Mohammed al-Baydhaq (c. 1150)
"Abu Mohammed Salih (1153–1234)
"Joseph ben Judah of Ceuta (c. 1160–1226)
"Abu al-Abbas al-Azafi (1162–1236)
"Abdelwahid al-Marrakushi (born 1185)
"Abu-l-Hassan ash-Shadhili (1196–1258)
"Abu Bakr al-Hassar (12th century)
"Abu Imran al-Fasi (died 1038)
"Isaac Alfasi (1013–1103)
"Mohammed ibn Tumart (c. 1080–1130)
"Qadi Ayyad ben Moussa (1083–1149)
"Mohammed al-Idrisi (1099–1165)
"Dunash ben Labrat (920–990), medieval Jewish commentator, poet, and grammarian
"Judah ben David Hayyuj (945–1000)
"David ben Abraham al-Fasi (c. 950–1000)
"Moroccans
"List of Morocco-related topics
"List of Moroccan Dutch people
"People born in Casablanca
"Pallache family
"Lists of Moroccan peopleLists of Arabs
