"Lists of Americans","Category:Lists_of_American_people"
"American Masters","Category:Lists_of_American_people"
"List of American Muslims","Category:Lists_of_American_people"
"List of American atheists","Category:Lists_of_American_people"
"List of denaturalized former citizens of the United States","Category:Lists_of_American_people"
"List of first gentlemen in the United States","Category:Lists_of_American_people"
"List of First Ladies of the United States","Category:Lists_of_American_people"
"Forbes 400","Category:Lists_of_American_people"
"List of people involved in the Fort Lee lane closure scandal","Category:Lists_of_American_people"
"Fortunate 400","Category:Lists_of_American_people"
"The Greatest American","Category:Lists_of_American_people"
"List of people from Guam","Category:Lists_of_American_people"
"List of Americans by net worth","Category:Lists_of_American_people"
"List of people from New England","Category:Lists_of_American_people"
"Nixon&#039;s Enemies List","Category:Lists_of_American_people"
"List of foreign nationals detained in North Korea","Category:Lists_of_American_people"
"List of people from the Northern Mariana Islands","Category:Lists_of_American_people"
"List of Old West gangs","Category:Lists_of_American_people"
"List of Old West gunfighters","Category:Lists_of_American_people"
"List of Old West lawmen","Category:Lists_of_American_people"
"Overturned convictions in the United States","Category:Lists_of_American_people"
"List of United States citizens granted political asylum in Cuba","Category:Lists_of_American_people"
"List of Puerto Ricans","Category:Lists_of_American_people"
"List of former United States citizens who relinquished their nationality","Category:Lists_of_American_people"
"List of richest Americans in history","Category:Lists_of_American_people"
"List of Americans under surveillance","Category:Lists_of_American_people"
"List of Americans in the Venona papers","Category:Lists_of_American_people"
"List of people from the United States Virgin Islands","Category:Lists_of_American_people"
"Lists of people by nationality","Category:Lists_of_American_people"
