"Michel Abitbol, Moroccan-born Israeli historian, professor and chair of the Department of African Studies at the Hebrew University of Jerusalem.
"Rajaâ Cherkaoui El Moursli, Moroccan nuclear physicist. Winner of a L'Oréal-UNESCO Award for Women in Science for her work on the Higgs Boson.
"David Assouline, Moroccan-born French historian and politician
"Moshe Bar-Asher, Moroccan-born Israeli linguist and the president of the Academy of the Hebrew Language in Jerusalem.
"Baruj Benacerraf, Venezuelan immunologist, Nobel Prize in Physiology or Medicine
"Paul Benacerraf, American philosopher working in the field of the philosophy of mathematics who has been teaching at Princeton University
"Samuel Benchimol, Brazilian economist, scientist and one of the leading experts on the Amazon region.
"Sara Bendahan, first Venezuelan woman to complete her medical studies in Venezuela.
"Merieme Chadid, astronomer and researcher
"Sami Shalom Chetrit, Moroccan Israeli University professor, Hebrew poet and Peace activist.
"Serge Haroche, Moroccan-born French physicist who was awarded the 2012 Nobel Prize for Physics
"Raphael Israeli, Moroccan-born Israeli scholar, Professor Emeritus of Middle Eastern, Islamic and Chinese history at the Hebrew University of Jerusalem.
"Marcelle Machluf, Moroccan-born Israeli biologist, director of the Laboratory for Cancer Drug Delivery &amp; Cell Based Technologies
"Adnane Remmal, Moroccan biologist
"Daniel Sivan, specialist of Hebrew language from Ben-Gurion University of the Negev
"Rachid Yazami, co-inventor of the lithium ion battery
"Haim Zafrani, Moroccan historian, specialist of Moroccan and North African history and Mediterranean Jewish history.
"Mohammed El Ifrani
"Al-Marrakushi
"Robert Assaraf, Moroccan-born French historian
"Nadia Bouras
"Abdelhadi Tazi
"Mustapha Adib, human rights activist
"Linor Abargil
"Reuven Abergel
"Kenza Drider, French Muslim activist who advocates for the right to wear the burqa
"Kacem El Ghazzali, secular blogger and activist
"Lamya Essemlali, French environmental activist, chairperson of Sea Shepherd France and Campaign Coordinator for Sea Shepherd Global.
"Saadia Marciano
"Mohamed Rabbae, Dutch-Moroccan politician and activist
"Abraham Serfaty, prominent dissident, militant, and political activist
"Mordechai Vanunu
"Avital Abergel, Israeli actress
"Ahmed Salah Abdelfatah, Dutch actor
"Yael Abecassis, Israeli actress
"Loubna Abidar, Moroccan actress
"Morjana Alaoui, Moroccan actress
"Fu'ad Aït Aattou, French actor
"Achmed Akkabi
"Natacha Amal
"Najib Amhali
"Reymond Amsalem, Israeli actress
"Richard Anconina, French actor
"Shiri Appleby, American actress
"Moran Atias, Israeli actress
"Aure Atika, French actress
"Amal Ayouch (born 1966), stage and film actress
"Mohammed Azaay
"Lubna Azabal, Belgian actress
"Samuel Benchetrit, French actor, scenarist, writer and director.
"Marc Bendavid, Canadian actor
"Omar Berdouni
"Miri Bohadana, Israeli actress and TV presentator
"Mohammed Chaara
"Emmanuelle Chriqui, Canadian actress
"Philippe Clair (Charles Bensoussan), Moroccan-born French actor, director, producer and screenwriter
"Adam Deacon
"Vincent Elbaz, French actor
"Jérémie Elkaïm, French actor
"Nadia Farès, French actress
"Houda Echouafni
"Mehdi El Glaoui
"Mamoun Elyounoussi
"Nabil Elouahabi
"Nora Fatehi, Canadian actress and dancer who works in Indian cinema
"Touriya Haoud, Dutch actress
"Maryam Hassouni, Dutch actress
"Sol Heras
"Aharon Ipalé
"Dana Ivgy, Israeli actress
"Moshe Ivgy, Moroccan-born Israeli actor
"Touriya Jabrane (Saadia Kraytif), Moroccan actress, theatre director and politician. Between 2007 and 2009, she held the position of Minister of Culture.
"Yasmine Lafitte (Hafida El Khabchi), Moroccan-born French pornographic actress
"Karen Lancaume (Karine Bach), French pornographic actress
"Danny Nucci, Italian-American actor
"Mimoun Oaïssa
"Mimoun Ouled Radi
"Zineb Oukach, Moroccan actress and model
"Ze’ev Revach, Moroccan-born Israeli actor, comedian and director
"Laila Rouass, British actress
"Nasser Saleh, Spanish actor
"Rosalinda Serfaty, Argentinian actress
"Leila Shenna, Moroccan actress
"Benjamin Siksou, French actor and singer
"Saïd Taghmaoui, French actor
"Elisa Tovati, French actress and singer
"Jake Weber, British actor
"Roschdy Zem, French actor and director
"Kim Edri
"Sara Chafak
"Maroua Kharbouch
"Shlomit Malka
"Mor Maman
"Richard Attias, businessman, events producer, founder and former chairman of PublicisLive and presently the executive chairman of Richard Attias and Associates
"Sylvain Abitbol, Canadian engineer and entrepreneur in the telecommunications industry as CEO of NHC Communications Inc
"Abdeslam Ahizoune, businessman, the Chairman and Chief Executive Officer of Maroc Telecom
"Aziz Akhannouch, businessman and current Minister of Agriculture
"Modar Alaoui, Moroccan-American serial entrepreneur based in Silicon Valley, California in the United States
"Alain J. P. Belda, Canadian-Moroccan businessman, former CEO of Alcoa
"Isaac Benayon Sabba, Brazilian entrepreneur, founder of the IB Sabbá Ltda. group and Petroleo Sabbá S.A.
"Othman Benjelloun, Moroccan businessman CEO of the BMCE
"Babette Bensoussan, Australian author and competitive intelligence specialist, who has written several books on competitive intelligence and analysis.
"Moses Bensusan, Canadian-American real estate developer CEO of Libery Grande and Logictech Construction Group.
"Jacky Ben-Zaken
"Miloud Chaabi
"Joseph Chetrit, Moroccan American real estate investor and developer
"Salomón Cohen Levy, Venezuelan-Israeli engineer and a real estate businessman.
"Albert Dadon, Moroccan Australian businessman
"Patrick Drahi, Moroccan businessman CEO of telecom group Altice
"Victor Drai, Moroccan American night-club owner
"Mahdi ElMandjra
"Sonia Gardner (née Lasry), Moroccan American billionaire hedge fund manager and co-founder of hedge fund Avenue Capital Group.
"Salwa Idrissi Akhannouch, businesswoman, the founder and CEO of the Aksal Group
"Daniel Iffla, French financier and philanthropist
"Amina Lahbabi-Peters, branding, marketing and Communication for Development specialist
"Marc Lasry, Moroccan American billionaire hedge fund manager and co-founder and chief executive officer of hedge fund Avenue Capital Group
"Maurice Lévy, Moroccan French businessman, CEO of Publicis
"Mostafa Terrab, businessman, current CEO of the Moroccan state-owned phosphate-mining company OCP
"Ary Abittan, French stand-up comedian
"Najib Amhali, Dutch-Moroccan stand-up comedian and actor
"Rachid Badouri, Canadian-Moroccan stand-up comedian
"Jamel Debbouze, French-Moroccan stand-up comedian, actor and producer
"Gad Elmaleh, French-Moroccan stand-up comedian, actor and producer
"Anne Roumanoff, French humorist and actress.
"Élie Semoun, French stand-up comedian and actor
"Hamed Abderrahaman Ahmad, Spanish suspected terrorist
"Mohamed Taieb Ahmed, Spanish drug lord trafficking hashish across the Strait of Gibraltar
"Samir Azzouz
"Said Bahaji
"Lalla Batoul, imprisoned and tortured under Sultan Abdelhafid
"Racid Belkacem
"Nordin Benallal, self-styled "escape king"
"Ibrahim Bin Shakaran
"Ahmed Bouchiki
"Mohammed Bouyeri
"Adil Charkaoui, Moroccan-born Canadian citizen who was arrested under security certificate in 2003.
"Tarek Dergoul
"Malika El Aroud
"Nathan Elbaz,
"Nouredine el Fahtni
"Farid Essebar
"Zakariya Essabar
"Younis Mohammad Ibrahim al-Hayyari
"Mounir El Motassadeq
"Khalil el-Moumni
"Ilan Halimi
"Jamila M'Barek
"Zacarias Moussaoui
"Lee Murray
"Abdelghani Mzoudi
"Abdellah Ouzghar, Moroccan suspected of ties to terrorist organizations.
"Younes Tsouli, Moroccan-British convicted guilty of incitement of terrorism
"Dan Attias, American television director and producer
"Nabil Ayouch, Moroccan French film director
"Lisa Azuelos, French director
"Jom Tob Azulay, Brazilian producer, director, writer, director of photography and soundman.
"Margot Benacerraf
"Hicham Bennir, Canadian director cinematographer editor and photographer
"Faouzi Bensaïdi
"Jacques Bensimon, Canadian public film and television director, producer and executive in Canada.
"Simone Bitton
"André Elbaz
"Olivier Dahan
"Ismaël Ferroukhi
"Sanaa Hamri
"Laila Marrakchi
"Hakim Nouri
"Michèle Ohayon, Academy Award-nominated film director, screenwriter and producer
"Mohamed Reggab, film director
"Heinz Tietjen
"Abdelhadi Tazi
"Malika Zouhali-Worrall
"Karima Adebibe, British model
"Moufid Aziz, Brazilian model
"Yigal Azrouël, Israeli American New York based fashion designer
"Elena Benarroch, Moroccan-Spanish fashion designer
"Albert "Aldo" Bensadoun, Canadian-Moroccan businessman, founder and chief executive of the ALDO Group, a retail shoe company based in Montreal, Quebec, Canada.
"Sara Chafak, Finnish model, winner of Miss Finland 2012
"Alber Elbaz, Moroccan-born Israeli fashion designer, who worked for the Lanvin house
"Joseph Ettedgui, British-Moroccan retailer, designer and founder of the Joseph brand
"Bouchra Jarrar, French haute couture fashion designer for Balenciaga and Lanvin
"Paul Marciano, American-Moroccan fashion designer and co-founder of Guess? Inc
"Joe Mimran, Canadian-Moroccan fashion designer and entrepreneur
"Pnina Tornai
"Muhammad Ben 'Abd al-Karim al-Khattabi
"Averroes (Abu El Walid Muhammad Ibn Ahmad Ibn Rushd)
"Moïse Maïmonide
"Judah ben David Hayyuj
"Muhammad al-Idrisi
"Muhammad al-Muqri
"Muley Xeque (1566–1621), Moroccan noble who converted to Catholicism in the 16th century
"Mohammed Abed Al-Jabri
"Ahmed El Inglizi
"David Levy Yulee
"Moses Elias Levy
"Robert Purvis (August 4, 1810 – April 15, 1898), American abolitionist in the United States
"Mouha ou Hammou Zayani, military figure who played an important role in the fight against French colonials
"Samuel Pallache, Jewish merchant, diplomat and pirate who was sent as an envoy to the Dutch Republic in 1608
"Lalla Zoulikha, famous Jewish martyr of the 19th century
"Tariq ibn Ziyad
"Ahmad ibn Ajiba, 18th-century Sufi saint
"Muhammad al-Jazuli, 15th-century Sufi leader of the Berber tribe of the Jazulah.
"Sidi Ahmed al-Tidjani, 18th-century Sufi scholar, founder of the Tijaniyya Sufi order.
"Ahmad al-Ghumari, traditionist and scholar of Hadith
"Abdullah al-Ghumari, 20th century Muslim preacher, jurist and theologian
"Abd al-Aziz al-Ghumari, 20th century Muslim scholar.
"Mohammed Moussaoui, Moroccan-born French Islamic theologist,  president of the French Council of Muslim Faith.
"Muhammad Abu Khubza, Muslim theologian, jurist, bibliographer and linguist.
"Solomon Abudarham
"Baruch Abuhassira
"Yaakov Abuhassira
"Israel Abuhassira, known as Baba Sali
"Amram Aburbeh
"Zechariah Aghmati
"Samuel Albas
"Isaac Alfassi, 11th-century Rabbi, Talmudist and posek
"Shlomo Amar, Sephardic Chief Rabbi of Jerusalem
"Raphael Ankawa
"Abraham Azulai
"Amram Ben Diwan
"David Ben Hassin
"Dunash Ben Labrat
"David Ben Shimon
"Raphael Berdugo
"Salomon Berdugo
"Shalom Buzaglo
"Kotel Dadon
"Yisroel Meir Gabbai
"Haim Ibn Attar
"Issachar Ben Mordecai Ibn Susan
"Abraham Ibn Zimra
"Jacob Ben Reuben Ibn Zur
"Yaakov Israel Ifargan
"Zion Levy
"David Messas
"Chalom Messas
"Haim Pinto
"Yosef Yitzhak Shloush
"David Rebibo, Moroccan-born American Rabbi
"Yoshiyahu Yosef Pinto, Israeli Orthodox rabbi who leads a global organization called Mosdot Shuva Israel.
"Laïla Abid,  Dutch-Moroccan journalist, presenter and news anchor
"Esmaa Alariachi, Dutch-Moroccan presenter
"Hajar Alariachi, Dutch-Moroccan presenter
"Jihad Alariachi, Dutch-Moroccan presenter
"Arthur (born Jacques Essebag), Moroccan-born French TV presenter, producer and comedian
"Tristane Banon, French journalist and writer
"Valérie Bénaïm, Moroccan-born French journalist, columnist, writer, TV Presenter and radio host
"Abdelkader Benali, Dutch-Moroccan writer and journalist
"Ahmed Benchemsi
"Sonia Benezra, Canadian TV and radio personality and actress
"Ralph Benmergui, Moroccan-Canadian television and radio personality
"Mohammed Benzakour, Dutch-Moroccan columnist, essayist, poet, politician and writer
"Hassnae Bouazza, Dutch-Moroccan journalist, columnist, writer, translator, TV program maker
"Karim Boukhari
"Abdellah Dami, Dutch-Moroccan presenter, journalist, writer
"Naima El Bezaz, Dutch-Moroccan writer, essayist, and journalist
"Ruth Elkrief, French television journalist
"Gilberto Dimenstein
"Kheredine Idessane, Scottish football commentator
"Salim Jay
"Najat Kaanache, Spanish cook and host of AMC Networks’ cooking series ‘’Cocina Marroqui’’
"Driss Ksikes
"Ali Lmrabet
"Omar Nasiri
"James Poniewozik, American journalist, and television critic (Moroccan mother)
"Ariel Wizman, French-Moroccan journalist, television personality, musician, DJ
"Richard Wolffe, British journalist
"Michaël Youn (Michaël Benayoun), French TV and radio personality, actor, singer, and comedian
"Rachid Ben Ali
"Mahi Binebine
"Chaïbia
"Noureddine Daifallah
"Abdellah Derkaoui, cartoonist
"Latifa Echakhch, French-Moroccan visual artist
"Bouchta El Hayani
"Tala Hadid
"Mohamed Hamri
"Bouchra Khalili
"Édouard Lock, Canadian dance choreographer and the founder of the Canadian dance group, La La La Human Steps
"Shuli Nachshon
"Alberto Pinto, Moroccan-born French photographer and interior designer
"Salah (dancer), French award-winning competitive hip-hop dancer
"Cyril Takayama, Japanese Illusionist
"Armand Amar, French composer
"Omer Avital, Israeli musician
"Shlomo Bar, Israeli musician and singer of Mizrahi music
"Henri Belolo, French music producer active during the disco era
"Ohad Benchetrit, Canadian musician
"Chico Bouchikhi (Jalloul Bouchikhi), French musician and a co-founder of the Gipsy Kings
"Avraham Eilam-Amzallag, Israeli musician
"David Guetta, French DJ
"Mahmoud Guinia, Gnawa music maâlem
"Hassan Hakmoun, Los Angeles-based Moroccan Gnawa musician
"Alain Macklovitch, Canadian DJ
"Maurice Ohana, French composer
"Adil Takhssait, Canadian rap and hip hop musician
"Adam Zindani
"Bouchaib Abdelhadi, American-Moroccan singer
"Zohra Al Fassiya, Moroccan classical singer of Malhoun music
"Jo Amar, Moroccan-born Israeli singer of Mizrahi music
"Amine (Amine Mounder), French-Moroccan R&amp;B singer
"Appa (Rachid El Ghazoui), Dutch-Moroccan rapper
"Malika Ayane, Italian singer
"Ali B (Ali Bouali), Dutch rapper and stand-up comedian
"Isam Bachiri, Danish rapper and member of Outlandish
"Farid Bang, born Farid El Abdellaoui, Spanish-born German rapper, songwriter, producer, CEO at Banger Musik Label
"Basim Danish singer (Danish Representative In Eurovision Song Contest 2014)
"Dounia Batma, Moroccan singer of Arabic pop music
"Laarbi Batma (1948–1998), Moroccan singer, leader of Nass El Ghiwane
"Rajae Belmlih, Moroccan singer of Arabic pop music
"Najoua Belyzel, French pop rock/electronic singer
"Zehava Ben, Israeli singer of Mizrahi music
"Nadja Benaissa, singer, songwriter and actress, member of No Angels
"Amel Bent, French pop singer
"Eden Ben Zaken, Israeli singer
"Amelle Berrabah, British singer and member of girl band Sugababes
"Isaac Bitton, drummer for Les Variations
"Raquel Bitton, French-Moroccan singer
"Soukaina Boukries, Moroccan pop singer
"Maya Bouskilla, Israeli pop singer
"Ahmed Chawki, Moroccan pop singer
"Abdessadeq Cheqara, Moroccan musician and Andalusi singer
"Cilvaringz (Tarik Azzougarh), Dutch rapper and hip hop producer associated with the Wu-Tang Clan
"Cut Killer (Anouar Hajoui), French DJ, actor and hip-hop recording artist
"Yosefa Dahari, Israeli singer of Mizrahi music
"Abdelwahab Doukkali, singer, songwriter and composer
"Dizzy DROS, rapper from Casablanca
"DJ Izm (Tarik Ejjamai), Australian rapper, member of the Multi-Platinum ARIA Award-winning Australian hip hop band Bliss n Eso
"Younes Elamine, singer-songwriter
"Gad Elbaz, Israeli singer of Sephardic Jewish music
"Sofia El Marikh, singer
"Rajae El Mouhandiz, singer, poet and producer
"Empire I (Miriam Moufide), Jamaica-based British singer songwriter and social activist
"Sofia Essaïdi, French-Moroccan singer
"Nadia Essadiqi, Canadian singer
"Fouradi (Mohamed and Brahim Fouradi), Dutch hip hop duo
"Eyal Golan, Israeli singer of Mizrahi music
"Laila Ghofran, singer of Arabic music
"Senna Guemmour, German singer-songwriter and a member of the pop group Monrose
"David Guetta, French house producer and DJ
"Shatha Hassoun, Iraqi-Moroccan singer of Arabic pop music
"Elam Jay, Moroccan Swiss singer and songwriter
"La Caution (Ahmed and Mohammed Mazouz), French hip-hop duo
"La Fouine (Laouni Mouhid), French rapper
"Leila K (Laila El Khalifi), Swedish Eurodance singer and former rapper
"Amir Haddad, French-Israeli singer of pop music
"Raphaël Haroche, French singer, songwriter and actor
"Ishtar, Israeli singer of Mizrahi and Arabic pop music
"Mor Karbasi, Israeli singer of Sephardic and Ladino music
"Rajaa Kasabni, Arabic singer, winner of the first season of the Arabic version of The X-Factor
"Kineret, Israeli-American singer of Jewish music
"Imad Kotbi, DJ and radio presenter
"Saad Lamjarred, Moroccan singer of Arabic pop music
"Asma Lamnawar, Moroccan singer of Arabic pop music
"Hind Laroussi, Dutch singer
"Loreen (Lorine Zineb Nora Talhaoui), Swedish singer (winner of Eurovision Song Contest 2012)
"Jannat Mahid, Moroccan singer of Arabic pop music
"Younes Megri, Moroccan singer, musician and actor
"Shiri Maimon, Israeli pop singer
"Sofia Mestari, French singer
"French Montana (Karim Kharbouch), American rapper
"Harel Moyal, Israeli pop singer
"Reinette L'Oranaise (Sultana Daoud), Algerian singer of Arab-Andalusian music
"Avi Peretz (singer), Israeli singer of Mizrahi music
"Kobi Peretz, Israeli singer of Mizrahi and pop music
"Moshe Peretz, Israeli singer of Mizrahi and pop music
"Édith Piaf, French cultural icon and France's greatest popular singer
"RedOne (Nadir Khayat), Dutch-Moroccan record producer/songwriter
"Kathleen Reiter, Canadian-Israeli pop singer, winner of the first season of The Voice Israel
"R3hab, Dutch-Moroccan DJ/producer
"Hoda Saad, singer, songwriter and composer
"Samira Said, singer of Arabic pop music
"Salah Edin (Abid Tounssi), Dutch rapper, one of the most successful artist in Arabic Hip-hop
"Sapho (Danielle Ebguy), French singer
"Houcine Slaoui, singer and composer
"Chico Slimani (Youssef Slimani), Moroccan British singer
"Sliimy (Yanis Sahraoui), French pop musician
"Ahmed Soultan, singer of Afro-Arabian Soul
"Fatima Tabaamrant, singer of Amazigh music
"Khleo Thomas, American actor, singer, and rapper
"Avi Toledano, Israeli singer of Mizrahi music
"Haim Ulliel, Israeli singer of Mizrahi music
"Wallen (Nawell Azzouz), French R&amp;B singer
"Hindi Zahra Moroccan French singer
"Brigitte Zarie, Canadian singer songwriter and composer
"Mohammed Achaari
"Mohammed ibn Mohammed Alami
"Mohammed ibn Idris al-Amrawi
"Muhammad Awzal, religious Berber poet from the 17th century.
"Kaddour El Alamy
"Abdellatif Laabi
"David Hassine, religious Jewish poet and Rabbi from the 17th century
"Hemmou Talb, 18th-century composer of poems in the Shilha Berber language
"Mustafa Aberchán, Spanish politician leader of the political organization Coalition for Melilla.
"Ahmed Aboutaleb, Mayor of Rotterdam
"Shai Abuhatsira
"Aharon Abuhatzira
"Roni Alsheikh
"Jacques Amir
"Shaul Amor
"Lolita Aniyar de Castro, Venezuelan teacher, lawyer, politician, and criminologist. She became the first Venezuelan woman to be elected as a Senator to the National Congress of Venezuela.
"Danny Atar
"Ariel Atias
"Shmuel Avital, Moroccan-born Israeli former politician who served as a minister responsible for social co-ordination from March 2001 to February 2002
"Idriss Azami Al Idrissi, politician
"André Azoulay, politician, counsellor to late king Hassan II and king Mohammed VI
"Audrey Azoulay, French politician Minister of Culture since February 2016
"Yosef Azran
"Aryeh Azulai
"David Azulai
"Driss Basri, politician who served as Interior Minister from 1979 to 1999
"Mohamed Benaissa, foreign minister
"Mehdi Ben Barka, politician, head of the left-wing National Union of Popular Forces (UNPF) and opponent of Hassan II
"Eli Ben-Dahan
"Shlomo Benizri
"Jamal Benomar
"Yahya Bennani, diplomat
"Abraham Bentes, Brazilian Army commander
"Fadel Benyaich, Moroccan-Spanish politician and businessman, Ambassador of Morocco in Spain
"David Bitan
"Shlomo Bohbot
"Rachad Bouhlal, diplomat
"Ahmed Boukhari, former agent of the Moroccan Secret Service
"Alima Boumediene-Thiery, French politician, Member of the European Parliament (1999-2004), of the Senate of France (2004-2011), and member of the French Green party.
"Asma Chaabi
"Yoni Chetboun
"Meir Cohen
"Yitzhak Cohen
"Nissim Dahan
"Yohanan Danino
"Danny Danon
"Rachida Dati, first woman from a non-European immigrant background to occupy a key ministerial position in the French Cabinet
"Eli Dayan
"Shlomo Dayan
"Driss Debbagh, former ambassador and minister
"Aryeh Deri
"Rafael Edri
"Yaakov Edri
"Gadi Eizenkot
"Kamal El-Hajji, British security official and civil servant, Serjeant-at-Arms of the House of Commons
"Karin Elharar
"Saïd El Khadraoui, Belgian politician
"Myriam El Khomri, Moroccan-born French politician, current Minister of Labour
"Rafi Elul
"Sari Essayah, Finnish member of the European Parliament
"Abdellatif Filali, Foreign Minister (1985-1989); Prime Minister (1994-1998)
"John Fritchey, Democratic member of the Illinois House of Representatives, representing the 11th District (1996–present)
"Tzachi Hanegbi
"Sharren Haskel
"Asher Hassin
"Fatima Houda-Pepin, Canadian politician and a member of the National Assembly of Quebec
"Leslie Hore-Belisha
"Driss Jettou, Prime Minister (2002–present)
"Omar Kabbaj, diplomat
"Avraham Kalfon
"Moshe Karadi
"Roger Karoutchi, French Ambassador to the OECD and former Secretary of State to the French Prime Minister
"Ahmed Lakhrif, Moroccan politician who held the position of Secretary of State for Foreign Affairs (2007-2008)
"David Levy (Israeli politician)
"Jackie Levy
"Maxim Levy
"Orly Levy
"Yitzhak Levy
"Waldemar Levy Cardoso
"David Magen
"Yoram Marciano
"Fatima Marouan (born 1952), politician, endocrinologist
"Mohamed Mediouri, politician, personal security of Hassan II and his senior bodyguard
"Aziz Mekouar, Moroccan diplomat, former Moroccan ambassador to the U.S., special adviser to the Presidency at BMCE and board member at the Bank of Africa
"Abdelaziz Meziane Belfqih, civil servant and senior advisor of king Mohammed VI
"Mohammed Moussaoui, president of the French Council of Muslim Faith
"Shuli Mualem
"Aharon Nahmias
"Yitzhak Navon
"Amir Ohana
"Asher Ohana
"Shimon Ohayon
"Ahmed Osman, former party leader
"Fathallah Oualalou, government minister
"Amir Peretz
"Yair Peretz
"Yitzhak Peretz
"Yitzhak Peretz
"Abderrahim Qanir
"Miri Regev
"Jorge Sampaio, Portuguese lawyer and politician who was the 18th President of Portugal (1996-2006) (Moroccan maternal grandmother)
"Bechor-Shalom Sheetrit
"Meir Sheetrit
"Shimon Shetreet
"Mahjoub Tobji, retired Commandant of the Royal Moroccan Army
"Avraham Toledano
"Shmuel Toledano
"Sami Turgeman (Shlomo "Sami" Turgeman), Major General in the IDF and is the current commander of the IDF Southern Command
"Yitzhak Vaknin
"Najat Vallaud-Belkacem, Moroccan-born French politician, became the first French woman to be appointed Minister of Education, Higher Education, and Research
"Yosef Vanunu
"Yehonatan Yifrah
"Abderrahmane Youssoufi, Prime Minister (1998-2002)
"Lalla Meryem, daughter of Hassan II
"Moulay Rachid, son of Hassan II
"Lalla Latifa Hammou, mother of king Mohammed VI
"Lalla Asma, daughter of Hassan II
"Lalla Hasna, daughter of Hassan II
"Moulay Abdallah, brother of Hassan II
"Moulay Hicham, son of Moulay Abdallah
"Lalla zineb, daughter of Moulay Abdallah
"Lalla Abla bint Tahar, wife of Mohammed V and mother of Hassan II
"Jonathan Ohayon, Canadian archer
"Abderrahman Ait Khamouch, Spanish-Moroccan Paralympic athlete
"Saïd Aouita
"Hasna Benhassi
"Abdellah Béhar
"Nezha Bidouane
"Brahim Boulami
"Hind Dehiba
"Hicham El Guerrouj
"Driss El Himer
"Nawal El Moutawakel
"Yousef El Nasri, Spanish retired long distance runner
"Sari Essayah, Finnish retired race walker
"Ilias Fifa, Spanish-Moroccan long-distance runner
"Jaouad Gharib
"Bouchra Ghezielle
"Salah Hissou
"Adil Kaouch
"Abderrahman Ait Khamouch, Spanish paralympic athlete
"Khalid Khannouchi, Moroccan American marathoner
"Brahim Lahlafi
"Driss Maazouzi
"Adel Mechaal, Spanish middle-distance runner
"Abdelaziz Merzougui, Spanish runner
"Mohamed Ouaadi
"Muncef Ouardi, Canadian speed skater
"Zahra Ouaziz
"Rashid Ramzi
"Ismaïl Sghyr
"Khalid Skah
"Achraf Tadili, Canadian runner competing over 800 meters
"Mounir Yemmouni
"Kamal Ziani, retired Spanish long-distance runner
"Bouchra Ghezielle, French-Moroccan track and field athlete
"Omri Casspi, Israeli basketball player
"Yogev Ohayon, Israeli basketball player
"Sophian Rafai, French-Moroccan basketball player
"Amit Simhon, Israeli basketball player
"Abdelhak Achik
"Mohammed Achik
"Najib Daho
"Yassine El Maachi
"Ismael El Massoudi, French boxer
"Karim El Ouazghari, Spanish boxer
"Ali Hallab
"Badr Hari
"Driss Moussaid
"Mahdi Ouatine
"Nordine Oubaali, French-Moroccan boxer
"Khalid Rahilou, French former professional boxer
"Tahar Tamsamani
"Hassan Saada, Moroccan boxer
"Thal Abergel, French chess Grandmaster
"Henry Ohayon, Israeli cyclist
"Lydia Hatuel-Czuckermann, Israeli Olympic fencer
"Yaniv Abargil, Israeli football player
"Zakariya Abarouai, French football player
"Yassine Abdellaoui, Dutch-Moroccan football player
"Yacine Abdessadki, French-Moroccan football player
"Laurent Abergel, French football player
"Shimon Abuhatzira, Israeli football player
"Moshe Abutbul, Israeli football player
"Shay Abutbul, Israeli football player
"Youssef Adnane, French-Moroccan football player
"Ibrahim Afellay, Dutch football player
"Achmed Ahahaoui, Dutch-Moroccan football player
"Ismail Aissati, Dutch-Moroccan football player
"Jamel Aït Ben Idir, French-Moroccan football player
